{
  "schema_version": "1",
  "handoff_path": "artifacts/train/distributed_shard_lineage_evidence_handoff.json",
  "locator_path": "artifacts/train/distributed_shard_lineage_transport_locator.json",
  "desired": {
    "shard_id": "train-shard-0003",
    "source": "fineweb-edu/slice",
    "source_revision": "2026-03-22-macbook-100m-tokens",
    "checkpoint_group": "ckpt-group-0007"
  },
  "current": {
    "handoff_path": "artifacts/train/distributed_shard_lineage_evidence_handoff.json",
    "shard_id": "train-shard-0003",
    "source": "fineweb-edu/slice",
    "source_revision": "2026-03-22-macbook-100m-tokens",
    "checkpoint_group": "ckpt-group-0007"
  },
  "reconciliation_status": "aligned"
}
